{"lang":"Javascript","fullPath":"/Statements/debugger","category":"Statements","title":"debugger","url":"/en-US/docs/Web/JavaScript/Reference/Statements/debugger","markdown":"# debugger\n\n The **`debugger`** statement invokes any available debugging functionality, such as setting a breakpoint. If no debugging functionality is available, this statement has no effect.\n\n## [Syntax](#syntax)\n\n```\ndebugger;\n\n```\n\n## [Examples](#examples)\n\n### [Using the debugger statement](#using%5Fthe%5Fdebugger%5Fstatement)\n\n The following example shows code where a `debugger` statement has been inserted, to invoke a debugger (if one exists) when the function is called.\n\n```\nfunction potentiallyBuggyCode() {\n  debugger;\n  // do potentially buggy stuff to examine, step through, etc.\n}\n\n```\n\n When the debugger is invoked, execution is paused at the `debugger` statement. It is like a breakpoint in the script source.\n\n![A browser with developer tools open to the debugger panel showing how execution is paused at the debugger statement to allow close inspection of variables, scopes, events, etc.](/en-US/docs/Web/JavaScript/Reference/Statements/debugger/screen_shot_2014-02-07_at_9.14.35_am.png) \n\n## [Specifications](#specifications)\n\n| Specification                                                                                                                                                                 |\n| ----------------------------------------------------------------------------------------------------------------------------------------------------------------------------- |\n| [ECMAScript Language Specification  \\# sec-debugger-statement](https://tc39.es/ecma262/multipage/ecmascript-language-statements-and-declarations.html#sec-debugger-statement) |\n\n## [Browser compatibility](#browser%5Fcompatibility)\n\nBCD tables only load in the browser\n\n## [See also](#see%5Falso)\n\n* [The Debugger in the Firefox Developer Tools](https://firefox-source-docs.mozilla.org/devtools-user/debugger/index.html)\n\n### Found a content problem with this page?\n\n* [Edit the page on GitHub](https://github.com/mdn/content/edit/main/files/en-us/web/javascript/reference/statements/debugger/index.md \"This will take you to GitHub, where you'll need to sign in first.\").\n* [Report the content issue](https://github.com/mdn/content/issues/new?template=page-report.yml&mdn-url=https%3A%2F%2Fdeveloper.mozilla.org%2Fen-US%2Fdocs%2FWeb%2FJavaScript%2FReference%2FStatements%2Fdebugger&metadata=%3C%21--+Do+not+make+changes+below+this+line+--%3E%0A%3Cdetails%3E%0A%3Csummary%3EPage+report+details%3C%2Fsummary%3E%0A%0A%2A+Folder%3A+%60en-us%2Fweb%2Fjavascript%2Freference%2Fstatements%2Fdebugger%60%0A%2A+MDN+URL%3A+https%3A%2F%2Fdeveloper.mozilla.org%2Fen-US%2Fdocs%2FWeb%2FJavaScript%2FReference%2FStatements%2Fdebugger%0A%2A+GitHub+URL%3A+https%3A%2F%2Fgithub.com%2Fmdn%2Fcontent%2Fblob%2Fmain%2Ffiles%2Fen-us%2Fweb%2Fjavascript%2Freference%2Fstatements%2Fdebugger%2Findex.md%0A%2A+Last+commit%3A+https%3A%2F%2Fgithub.com%2Fmdn%2Fcontent%2Fcommit%2F0f3738f6b1ed1aa69395ff181207186e1ad9f4d8%0A%2A+Document+last+modified%3A+2023-02-21T00%3A33%3A34.000Z%0A%0A%3C%2Fdetails%3E \"This will take you to GitHub to file a new issue.\").\n* [View the source on GitHub](https://github.com/mdn/content/blob/main/files/en-us/web/javascript/reference/statements/debugger/index.md?plain=1 \"Folder: en-us/web/javascript/reference/statements/debugger (Opens in a new tab)\").\nWant to get more involved? [Learn how to contribute](https://github.com/mdn/content/blob/main/CONTRIBUTING.md \"This will take you to our contribution guidelines on GitHub.\").\n\nThis page was last modified on Feb 21, 2023 by [MDN contributors](/en-US/docs/Web/JavaScript/Reference/Statements/debugger/contributors.txt)."}